Vegetables grown in the vicinity of an industrial area were most contaminated while vegetables grown in rural area were least contaminated. _	1
Analytical results indicated that the concentration of lead in 35% vegetable samples collected from industrial area were more than maximum permitted limit. _	1
The high concentration of cadmium was found in onion and coriander, while lead content was recorded high in spinach and cauliflower. @	1
Arsenic concentration in 25% samples collected from industrial area was more than maximum permitted limit. @	1
Copper concentration in most of the vegetable sample was within permissible limit; only two out of forty samples have high concentration of copper. @	1
The results of the study showed that consumers are at greater risk of purchasing these fresh vegetables with high levels of heavy metals beyond permissible limits as defined by the Indian Prevention of Food Adulteration Act, 1954. @	1
The study was conducted to find out the content of lead (Pb), cadmium (Cd), arsenic (As) and copper (Cu) in some selected vegetables grown in and around Nashik city, Maharashtra state (India). `	0
Vegetable samples from four different sites were collected and digested by using tri-acid digestion method. `	0
Concentrations of heavy metals were analyzed by using atomic absorption spectrophotometer. `	0
Results: We demonstrate that S. aureus α-toxin activates the acid sphingomyelinase in ex vivo macrophages and triggers a release of ceramides. _	1
Ceramides induced by S. aureus α-toxin localize to lysosomes and mediate a release of cathepsin B and D from lysosomes into the cytoplasm. _	1
Cytosolic cathepsin B forms a complex with Nlrc4. @	1
Treatment of macrophages with α-toxin induces the formation of IL-1β and TNF-α. @	1
These events are reduced or abrogated, respectively, in cells lacking the acid sphingomyelinase and upon treatment of macrophages with amitriptyline, a functional inhibitor of acid sphingomyelinase. @	1
Pharmacological inhibition of cathepsin B prevented activation of the inflammasome measured as release of IL-1β, while the formation of TNF-α was independent of cathepsin B. @	1
Conclusion: We demonstrate a novel mechanism how bacterial toxins activate the inflammasome and mediate the formation and release of cytokines: S. aureus α-toxin triggers an activation of the acid sphingomyelinase and a release of ceramides resulting in the release of lysosomal cathepsin B and formation of pro-inflammatory cytokines. @	1
Background/Aims: Staphylococcus aureus (S. aureus) infections are a major clinical problem and range from mild skin and soft-tissue infections to severe and even lethal infections such as pneumonia, endocarditis, sepsis, osteomyelitis, and toxic shock syndrome. `	0
Toxins that are released from S. aureus mediate many of these effects. `	0
Here, we aimed to identify molecular mechanisms how α-toxin, a major S. aureus toxin, induces inflammation. `	0
Methods: Macrophages were isolated from the bone marrow of wildtype and acid sphingomyelinase-deficient mice, stimulated with S. aureus α-toxin and activation of the acid sphingomyelinase was quantified. `	0
The subcellular formation of ceramides was determined by confocal microscopy. _	0
Release of cathepsins from lysosomes, activation of inflammasome proteins and formation of Interleukin-1β (IL-1β) and Tumor Necrosis Factor-α (TNF-α) were analyzed by western blotting, confocal microscopy and ELISA. _	0
Phylogenetic analysis of 16S rRNA gene sequences placed the strain in the family Thermaceae in the phylum 'Deinococcus-Thermus', which is consistent with the chemotaxonomic data. @	1
On the basis of phenotypic and phylogenetic data, strain 2M70-1(T) ( = JCM 15963(T)  = DSM 22268(T)) represents the type strain of a novel species of a novel genus, for which the name Rhabdothermus arcticus gen. nov., sp. @	1
nov. is proposed. @	1
A novel thermophilic member of the family Thermaceae, designated strain 2M70-1(T), was isolated from the wall of an active white smoker chimney collected in the Soria Moria vent field at 71 °N in the Norwegian-Greenland Sea. `	0
Cells of the strain were Gram-negative, non-motile rods. `	0
Growth was observed at 37-75 °C (optimum 65 °C), at pH 6-8 (optimum pH 7.3) and in 1-5 % (w/v) NaCl (optimum 2.5-3.5 %). `	0
The isolate was aerobic but could also grow anaerobically using nitrate or elemental sulfur as electron acceptors. `	0
The strain was obligately heterotrophic, growing on complex organic substrates like yeast extract, Casamino acids, tryptone and peptone. _	0
Pyruvate, acetate, butyrate, sucrose, rhamnose and maltodextrin were used as complementary substrates. _	0
The G+C content of the genomic DNA was 68 mol%. _	0
Cells possessed characteristic phospholipids and glycolipids. _	0
Major fatty acids constituted saturated and unsaturated iso-branched and saturated anteiso-branched forms. @	0
Menaquinone 8 was the sole respiratory lipoquinone. @	0
This study investigates MGDM with decision information taking the form of I-HFEs and their special cases. _	1
Based on some aggregation operators of I-HFEs, three approaches for distinct scenarios of MGDM are proposed and clarified by a practical problem involved with supplier selection. @	1
Comparisons between the proposed approaches and the existing methods show that the proposed approaches are more rational than those by aggregating the evaluations directly in MGDM. @	1
AbstractMulti-groups decision making (MGDM) problems, which contain multiple groups of experts acting collectively to evaluate a set of alternatives with respect to several criteria, are focused on in this study. `	0
The existing solutions for MGDM are to aggregate the evaluations three times at different levels, which leads to less accuracy and more computational complexities. `	0
Intuitionistic-valued hesitant fuzzy elements (I-HFEs) which consider all possible values instead of aggregation straightforward are flexible to represent the experts' opinions and lessen the steps of aggregations. _	0
In this paper, we examine a new feature, accent ratio, which captures how likely it is that a word will be realized as prominent or not. _	1
AbstractThe immense prosodic variation of natural conversational speech makes it challenging to predict which words are prosodically prominent in this genre. `	0
Observed and Chao-1 estimated species richness, as well as Shannon diversity of wild bees visiting blueberries were significantly higher in Michigan where the crop is within its native range. _	1
The regional bee communities were also significantly different, with Michigan farms having greater dissimilarity than British Columbia. _	1
Blueberry fields in British Columbia had fewer visits by honey bees than those in Michigan, irrespective of stocking rate, and they also had lower berry weights and a significant pollination deficit. _	1
In British Columbia, pollination service increased with abundance of wild bumble bees, whereas in Michigan the abundance of honey bees was the primary predictor of pollination. @	1
The proportion of semi-natural habitat at local and landscape scales was positively correlated with wild bee abundance in both regions. @	1
Wild bee abundance declined significantly with distance from natural borders in Michigan, but not in British Columbia where large-bodied bumble bees dominated the wild bee community. @	1
Our results highlight the varying dependence of crop production on different types of bees and reveal that strategies for pollination improvement in the same crop can vary greatly across production regions. @	1
Highbush blueberry yields are dependent on pollination by bees, and introduction of managed honey bees is the primary strategy used for pollination of this crop. `	0
Complementary pollination services are also provided by wild bees, yet highbush blueberry is increasingly grown in regions outside its native range where wild bee communities may be less adapted to the crop and growers may still be testing appropriate honey bee stocking densities. `	0
To contrast crop pollination in native and non-native production regions, we sampled commercial 'Bluecrop' blueberry fields in British Columbia and Michigan with grower-selected honey bee stocking rates (0-39.5 hives per ha) to compare bee visitors to blueberry flowers, pollination and yield deficits, and how those vary with local- and landscape-scale factors. `	0
The involucrin genes of the dog and the pig have been cloned and sequenced. `	1
Like the corresponding genes of the prosimians, each contains a homologous segment of short tandem repeats at the same position in the coding region. `	0
However, the codon sequence of the repeats in the prosimians differs significantly from that of the nonprimate mammals. _	0
This evolution has been brought about by a combination of genetic modifications (selective deletions, mutations, and gene conversions). _	0
In the anthropoids, this segment of repeats was replaced by a modern one differing in location, sequence, and repeat length. @	0
In several of its properties the modern segment has continued the prosimian trend away from the nonprimates. @	0
The overall direction of the evolution of this segment has therefore been maintained even though there have been sudden changes in the evolutionary processes acting on the gene. @	0
The authors estimated odds ratios using conditional logistic regression analyses, adjusted for education and tobacco use (snuff use in the smoking analysis and smoking in the snuff analysis). _	1
The risk of acoustic neuroma was greatly reduced in male current smokers (odds ratio (OR) = 0.41, 95% confidence interval (CI): 0.23, 0.74) and moderately reduced in female current smokers (OR = 0.70, 95% CI: 0.40, 1.23). @	1
In contrast, current snuff use among males was not associated with risk of acoustic neuroma (OR = 0.94, 95% CI: 0.57, 1.55). @	1
The authors' findings are consistent with previous reports of lower acoustic neuroma risk among current cigarette smokers than among never smokers. @	1
The absence of an association between snuff use and acoustic neuroma suggests that some constituent of tobacco smoke other than nicotine may confer protection against acoustic neuroma. @	1
Two previous studies suggest that cigarette smoking reduces acoustic neuroma risk; however, an association between use of snuff tobacco and acoustic neuroma has not been investigated previously. `	0
The authors conducted a case-control study in Sweden from 2002 to 2007, in which 451 cases and 710 population-based controls completed questionnaires. `	0
Cases and controls were matched on gender, region, and age within 5 years. _	0
RESULTS About 48.7% of the clinicians meet the criteria for burnout according to the CBI. @	1
Moreover, in multivariate logistic regression analyses, burnout is significantly associated with perceived quality of care among male (odds ratios vary from 1.5 to 2.6) but not among female surgeons (odds ratios vary from 1.3 to 1.5). @	1
CONCLUSIONS The high prevalence of burnout in our study corresponds with former studies of burnout among physicians. @	1
Furthermore, the results of the study suggest a relationship between burnout and perceived quality of care among men. @	1
Thus, reducing burnout among surgeons could not only improve their health and well-being but also the quality of care. @	1
OBJECTIVE Burnout is highly prevalent among clinicians but there is not much known about the association between burnout and quality of care. `	0
In this paper, burnout, perceived quality of care and medical errors among German clinicians in surgery are explored. `	0
DESIGN Data were collected during 2008 by a cross-sectional, standardized mail survey. `	0
PARTICIPANTS and   SETTING A total of 1311 clinicians in surgery in 489 German hospitals. _	0
Measure(s) Burnout was measured by using the Copenhagen Burnout Inventory (CBI). _	0
The measurement of self-rated patient care was based on a 13 item instrument (Chirurgisches Qualitätssiegel) and two questions assessing the frequency of medical errors. _	0
We introduce an entanglement branching operator to split a composite entanglement flow in a tensor network which is a promising theoretical tool for many-body systems. `	1
We can optimize an entanglement branching operator by solving a minimization problem based on squeezing operators. `	1
The entanglement branching is a new useful operation to manipulate a tensor network. _	1
For example, finding a particular entanglement structure by an entanglement branching operator, we can improve a higher-order tensor renormalization group method to catch a proper renormalization flow in a tensor network space. _	1
This new method yields a new type of tensor network states. @	1
The second example is a many-body decomposition of a tensor by using an entanglement branching operator. @	1
We can use it for a perfect disentangling among tensors. @	1
Applying a many-body decomposition recursively, we conceptually derive projected entangled pair states from quantum states that satisfy the area law of entanglement entropy. @	1
rhIL-7 induced in vivo T cell cycling, bcl-2 up-regulation, and a sustained increase in peripheral blood CD4(+) and CD8(+) T cells. _	1
This T cell expansion caused a significant broadening of circulating T cell receptor (TCR) repertoire diversity independent of the subjects' age as naive T cells, including recent thymic emigrants (RTEs), expanded preferentially, whereas the proportions of regulatory T (T reg) cells and senescent CD8(+) effectors diminished. @	1
The resulting composition of the circulating T cell pool more closely resembled that seen earlier in life. @	1
This profile, distinctive among cytokines under clinical development, suggests that rhIL-7 therapy could enhance and broaden immune responses, particularly in individuals with limited naive T cells and diminished TCR repertoire diversity, as occurs after physiological (age), pathological (human immunodeficiency virus), or iatrogenic (chemotherapy) lymphocyte depletion. @	1
Interleukin-7 (IL-7) is a homeostatic cytokine for resting T cells with increasing serum and tissue levels during T cell depletion. `	0
In preclinical studies, IL-7 therapy exerts marked stimulating effects on T cell immune reconstitution in mice and primates. `	0
First-in-human clinical studies of recombinant human IL-7 (rhIL-7) provided the opportunity to investigate the effects of IL-7 therapy on lymphocytes in vivo. _	0
RESULTS Functional connectivity with the sensorimotor network was reduced in patients compared to controls (p = 0.011) in the left inferior frontal gyrus, i.e. @	1
Broca's area as identified by the word-generation task. @	1
No aberrant functional connectivity values were found in the other regions of interest, nor were any associations found between functional connectivity and language performance. @	1
Neuropsychological testing confirmed language impairment in patients relative to controls (reductions in core language score, p = 0.03; language content index, p = 0.01; receptive language index, p = 0.005). @	1
CONCLUSION Reduced functional connectivity was demonstrated between the sensorimotor network and the left inferior frontal gyrus (Broca's area) in children with RE, which might link epileptiform activity/seizures originating from the sensorimotor cortex to language impairment, and is in line with the identified neuropsychological profile of anterior language dysfunction. @	1
INTRODUCTION Over the last years, evidence has accumulated that rolandic epilepsy (RE) is associated with serious cognitive comorbidities, including language impairment. `	0
However, the cerebral mechanism through which epileptiform activity in the rolandic (sensorimotor) areas may affect the language system is unknown. `	0
To investigate this, the connectivity between rolandic areas and regions involved in language processing is studied using functional MRI (fMRI). `	0
MATERIALS AND METHODS fMRI data was acquired from 22 children with rolandic epilepsy and 22 age-matched controls (age range: 8-14 years), both at rest and using word-generation and reading tasks. `	0
Activation map analysis revealed no group differences (FWE-corrected, p < 0.05) and was therefore used to define regions of interest for pooled (patients and controls combined) language activation. _	0
Independent component analysis with dual regression was used to identify the sensorimotor resting-state network in all subjects. _	0
The associated functional connectivity maps were compared between groups at the regions of interest for language activation identified from the task data. _	0
In addition, neuropsychological language testing (Clinical Evaluation of Language Fundamentals, 4th edition) was performed. _	0
RESULTS We found significant cross-lagged paths from prior PA to later depression as well as from prior depression to later PA (beta values = -.039 to -.047). @	1
After subdividing depression into affective and somatic symptoms, the affective symptoms were reciprocally related to PA, whereas the paths between somatic symptoms and PA did not reach statistical significance. @	1
CONCLUSIONS An inverse bidirectional association between PA and general depressive symptoms was observed. @	1
This association was restricted to affective symptoms. @	1
PURPOSE Low levels of physical activity (PA) have been shown to be associated with depression in adults. `	0
The few studies that focused on adolescents yielded mixed and inconsistent results. `	0
Efforts to examine the direction of this relationship have been inconclusive up to now. `	0
The aims of this study were therefore to investigate (1) the direction of the inverse association between PA and depressive symptoms over time, and (2) whether these associations are specific to particular clusters of depressive symptoms in adolescents. _	0
METHODS Depressive symptoms and PA were assessed in a population sample of adolescents (N = 2,230) who were measured at three waves between age 10 and age 17. _	0
Depressive symptoms were measured by the Affective Problems scale of the Youth Self-Report and Child Behavior Checklist, whereas PA was operationalized as the amount of time spent on physical exercise. _	0
Structural equation modeling was used to examine bidirectional effects of PA and depressive symptoms over time. @	0
The in vitro cytotoxicity of 4-HPR was not affected by ketoconazole (p ≥ 0.06). _	1
Ketoconazole increased intratumoral levels of 4-HPR (p = 0.02), of the active 4-oxo-4-HPR metabolite (p = 0.04), and intratumoral apoptosis (p ≤ 0.0006), compared to 4-HPR/LXS-alone. _	1
Concurrent ketoconazole increased EFS in both CDX models compared to 4-HPR/LXS-alone (p ≤ 0.008). @	1
4-HPR + ketoconazole also increased EFS in PDX models compared to controls (p ≤ 0.03). @	1
Thus, concurrent ketoconazole decreased 4-HPR metabolism with resultant increases of plasma and intratumoral drug levels and antitumor effects in neuroblastoma murine xenografts. @	1
These results support the clinical testing of concurrent ketoconazole and oral fenretinide in neuroblastoma. @	1
We previously reported that concurrent ketoconazole, an oral anti-fungal agent and P450 enzyme inhibitor, increased plasma levels of the cytotoxic retinoid, fenretinide (4-HPR) in mice. `	0
We have now determined the effects of concurrent ketoconazole on 4-HPR cytotoxic dose-response in four neuroblastoma (NB) cell lines in vitro and on 4-HPR activity against two cell line-derived, subcutaneous NB xenografts (CDX) and three patient-derived NB xenografts (PDX). `	0
Cytotoxicity in vitro was assessed by DIMSCAN assay. `	0
Xenografted animals were treated with 4-HPR/LXS (240 mg/kg/day) + ketoconazole (38 mg/kg/day) in divided oral doses in cycles of five continuous days a week. `	0
In one model, intratumoral levels of 4-HPR and metabolites were assessed by HPLC assay, and in two models intratumoral apoptosis was assessed by TUNEL assay, on Day 5 of the first cycle. _	0
Antitumor activity was assessed by Kaplan-Meier event-free survival (EFS). _	0
Employing a transcription factor, ABF2, which controls the ABA-dependent gene expression via the G-box type ABA-responsive elements, we isolated an arm repeat protein. _	1
The ABF2-interacting protein, designated as ARIA (arm repeat protein interacting with ABF2), has another conserved sequence motif, BTB/POZ (broad complex, tramtrak, and bric-a-brac/poxvirus and zinc finger) domain, in the C-terminal region. _	1
The physiological relevance of ABF2-ARIA interaction was supported by their similar expression patterns and similar subcellular localization. @	1
Plants overexpressing ARIA are hypersensitive to ABA and high osmolarity during germination and insensitive to salt during subsequent seedling growth. @	1
By contrast, an ARIA knockout mutant exhibits ABA and glucose insensitivities. @	1
Changes in the expression levels of several ABF2-regulated genes were also observed in ARIA overexpression lines, indicating that ARIA modulates the transcriptional activity of ABF2. @	1
Together, our data indicate that ARIA is a positive regulator of ABA response. @	1
Arabidopsis (Arabidopsis thaliana) genome contains more than 90 armadillo (arm) repeat proteins. `	0
However, their functions are largely unknown. `	0
Here, we report that an Arabidopsis arm repeat protein is involved in abscisic acid (ABA) response. `	0
We carried out two-hybrid screens to identify signaling components that modulate ABA-responsive gene expression. _	0
Here, numerical calculations of such textural equilibrium geometries are presented for a space-filling tessellation of grains with a tetrakaidecahedral (truncated octahedral) unit cell. `	1
Two parameters determine the nature of the geometries: the porosity and the dihedral angle. _	1
A variety of distinct melt topologies occur for different combinations of these two parameters, and the boundaries between different topologies has been determined. _	1
For small dihedral angles, wetting of grain boundaries occurs once the porosity has exceeded 11%. @	1
An exhaustive account is given of the main properties of the geometries: their energy, pressure, mean curvature, contiguity, and areas on cross-sections and faces. @	1
Their effective permeabilities have been calculated, and demonstrate a transition between a quadratic variation with porosity at low porosities to a cubic variation at high porosities. @	1
In textural equilibrium, partially molten materials minimise the total surface energy bound up in grain boundaries and grain-melt interfaces. `	0
The mechanisms for these classical morphological responses to axotomy have not been satisfactorily explained.ResultsIn this study we address the role of the cell body cytoskeleton in these structural changes. `	1
We show that the cytoskeleton of uninjured lumbar motor neuron cell bodies maintains nucleolar, nuclear and cell body size and nuclear position. _	1
When isolated, the relatively insoluble cell body cytoskeleton contains Nissl bodies and lipofuscin granules. _	1
After axotomy, protein labeling increases markedly and the cytoskeleton enlarges, increasing nucleolar, nuclear and cell body size, as well as nuclear eccentricity. @	1
Nearly all of the protein mass that accumulates in the cell body after axotomy appears to be added to the cytoskeleton.ConclusionWe conclude that axotomy causes the conjugate enlargement of the nucleolus, nucleus and cell body and increases nuclear eccentricity in spinal motor neurons by adding protein to the cytoskeleton. @	1
The change in nuclear position, we propose, occurs when cytoskeletal elements of the axon cannot enter the shortened axon and "dam up" between the nucleus and axon hillock. @	1
As a consequence, we suggest that Nissl body-free axonal cytoskeleton accumulates between the nucleus and axon, displaces Nissl body-containing cytoskeleton, and produces central chromatolysis in that region of the cell. @	1
BackgroundWhen spinal motor axons are injured, the nucleolus, nucleus and cell body of the injured cell transiently increase in size, the nucleus becomes more eccentrically placed, and the organization of polyribosomes into Nissl bodies is temporarily disrupted. `	0
Using exact dates of birth for inmates in state and federal prisons in 1979, 1986, and 1991, we find robust evidence of effects on violent crimes among whites. `	1
In particular, we find that draft eligibility increases incarceration rates for violent crimes by 14 to 19 percent. _	1
Based on Angrist and Chen's (2008) estimate of the effect of draft eligibility on veteran status, these estimates imply that military service increases the probability of incarceration for a violent crime by 0.27 percentage points. _	1
Results for nonwhites are not robust. @	1
We conduct two falsification tests, one that applies each of the three binding lotteries to unaffected cohorts and another that considers the effects of lotteries that were not used to draft servicemen. @	1
Draft lottery number assignment during the Vietnam era provides a natural experiment to examine the effects of military service on crime. `	0
In this study expression analysis of BTG1 was conducted to clarify the role of BTG1 in the initiation of HCC carcinogenesis and progression. `	1
BTG1 mRNA expression levels were determined for HCC cell lines and 151 surgical specimen pairs using quantitative real‑time reverse transcription polymerase chain reaction (RT‑qPCR) assay. `	1
The mutational and methylation status of HCC cell lines were analyzed via high resolution melting (HRM) analysis and direct sequencing analysis to elucidate the regulatory mechanisms of BTG1 expression. `	1
The expression and distribution of the BTG1 protein in liver tissues were evaluated using immunohistochemistry (IHC). _	1
Decreased expression of BTG1 mRNA was confirmed in the majority of HCC cell lines (89%) and clinical HCC tissues (85%) compared with non‑cancerous liver tissues. _	1
