Given a smooth submanifold $H \subset M$ of codimension $k\geq 1$, we find conditions on the pair $(\{\phi_h\},H)$ for which $$ \Big|\int_H\phi_hd\sigma_H\Big|=o(h^{\frac{1-k}{2}}),\qquad h\to 0^+. _	1
In particular, we show that the upper bound holds for any $H$ if $(M,g)$ is surface with Anosov geodesic flow or a manifold of constant negative curvature. @	1
The results are obtained by characterizing the behavior of the defect measures of eigenfunctions with maximal averages. @	1
Let $(M,g)$ be a smooth, compact Riemannian manifold and $\{\phi_h\}$ an $L^2$-normalized sequence of Laplace eigenfunctions, $-h^2\Delta_g\phi_h=\phi_h$. `	0
$$ One such condition is that the set of conormal directions to $H$ that are recurrent has measure $0$. @	0
Analysis of recombination rates along rice chromosomes confirms a positive correlation between the occurrence of TAGs and recombination rate, as found in Arabidopsis. _	1
We speculate that these observations reflect an evolutionary trend in which successful tandem duplication involves genes either at the end of biochemical pathways or in flexible steps in a pathway, for which fluctuation in copy number is unlikely to affect downstream genes. @	1
In Arabidopsis, tandemly arrayed genes (TAGs) comprise .10% of the genes in the genome. `	0
These duplicated genes represent a rich template for genetic innovation, but little is known of the evolutionary forces governing their generation and maintenance. `	0
Here we compare the organization and evolution of TAGs between Arabidopsis and rice, two plant genomes that diverged ;150 million years ago. `	0
TAGs from the two genomes are similar in a number of respects, including the proportion of genes that are tandemly arrayed, the number of genes within an array, the number of tandem arrays, and the dearth of TAGs relative to single copy genes in centromeric regions. _	0
TAGs are also biased functionally relative to duplicated, nontandemly arrayed genes. _	0
In both genomes, TAGs are enriched for genes that encode membrane proteins and function in ''abiotic and biotic stress'' but underrepresented for genes involved in transcription and DNA or RNA binding functions. @	0
Despite differences in the age distribution of tandem arrays, the striking similarities between rice and Arabidopsis indicate similar mechanisms of TAG generation and maintenance. @	0
This article reviews the relapse rate after cessation of treatment with NAs in chronic hepatitis B patients with the goal of identifying possible predictive factors of relapse. @	1
The introduction of nucleot(s)ide analogues (NAs) for oral antiviral therapy has dramatically improved the clinical outcome of patients with chronic hepatitis B. NAs appear to be safe and induce potent suppression of viral replication. `	0
However, they are associated with a low rate of HBsAg seroclearance, the gold standard of successful treatment, and also with a relatively high rate of virological relapse after discontinuation. `	0
As a result, long-term treatment is needed. _	0
The optimal duration of NA treatment currently remains unclear, nevertheless in some patients NA treatment can be stopped with a relatively low probability of relapse. _	0
Whether NAs are able to induce a sustained off-treatment response is an important area for research. @	0
Global location sensing (gls) loggers were used in combination with the trophic ecology of tracked individuals, inferred from the isotopic signatures of wing feathers. `	1
Results suggest that these two Macaronesian shearwater sub-populations do segregate during the non-breeding period in some 'sub-population-specific' regions, by responding to different oceanographic characteristics (habitat modelling). _	1
Within these disparate areas, both sub-populations behave differently (at-sea activity) and prey on disparate trophic niches (stable isotope analysis). _	1
Finally, when comparing to the results of former studies reporting on the spatial, behavioural and trophic choices of Macaronesian shearwater populations breeding on Azores and Canary Islands, we realized the high ecological plasticity of this species inhabiting and foraging over the North-East Atlantic Ocean. @	1
In this work we investigated the between-colony spatial, behavioural and trophic segregation of two sub-populations of the elusive Macaronesian shearwaters Puffinus baroli breeding only ~340 km apart in Cima Islet (Porto Santo Island) and Selvagem Grande Island. `	0
One hypothesis would be that each sub-population have evolved and adapted to feed on particular and 'sub-population-specific' resources, and the segregation observed at the three different levels (spatial, behavioural and trophic) might be in fact a result of such adaptation, from the emergence of 'cultural foraging patterns'. @	0
We report on the development of self‐immolative nanoparticles capable of simultaneously delivering miR‐34a mimic and targeting dysregulated polyamine metabolism in cancer. `	1
The nanoparticles were prepared from a biodegradable polycationic prodrug, named DSS‐BEN, which was synthesized from a polyamine analog N1,N11‐bisethylnorspermine (BENSpm). `	1
The nanoparticles were selectively disassembled in the cytoplasm where they released miRNA. _	1
Glutathione (GSH)‐induced degradation of self‐immolative linkers released BENSpm from the DSS‐BEN polymers. _	1
MiR‐34a mimic was effectively delivered to cancer cells as evidenced by upregulation of intracellular miR‐34a and downregulation of Bcl‐2 as one of the downstream targets of miR‐34a. _	1
Intracellular BENSpm generated from the degraded nanoparticles induced the expression of rate‐limiting enzymes in polyamine catabolism (SMOX, SSAT) and depleted cellular natural polyamines. _	1
Simultaneous regulation of polyamine metabolism and miR‐34a expression by DSS‐BEN/miR‐34a not only enhanced cancer cell killing in cultured human colon cancer cells, but also improved antitumor activity in vivo. @	1
The reported findings validate the self‐immolative nanoparticles as delivery vectors of therapeutic miRNA capable of simultaneously targeting dysregulated polyamine metabolism in cancer, thereby providing an elegant and efficient approach to combination nanomedicines. @	1
Abstract Combination of anticancer drugs with therapeutic microRNA (miRNA) has emerged as a promising anticancer strategy. `	0
However, the promise is hampered by a lack of desirable delivery systems. `	0
Graphical abstract Figure. @	0
No Caption available. @	0
We present an experiment to compare a standard, minimally distinguishing algorithm for the generation of relational referring expressions with two alternatives that produce overspecified descriptions. `	1
The experiment shows that discrimination which normally plays a major role in the disambiguation task is also a major influence in referential overspecification, even though disambiguation is in principle not relevant. _	1
METHODS This study represents data from the biopsy samples of six individuals suffering from UC. `	1
The samples were collected by colonoscopy and were processed immediately for isolation of DNA. _	1
Mucosal microbiota was analyzed by means of 16S rRNA gene-based Illumina high throughput sequencing. _	1
Quantitative real-time PCR (qPCR) was performed to determine total bacterial abundances. _	1
RESULTS Analysis of 23,927 OTUs demonstrated a significant reduction of bacterial diversity consistently from phylum to species level (p < 0.05) for individuals suffering from severe stage of UC. @	1
Significant increase in abundance of unusual aerobes and facultative anaerobes, including members from the phylum Proteobacteria (p- = 0.031) was also observed. @	1
A 10 fold increase in the total bacterial count was detected in patients suffering from severe inflammatory stage (2.98 +/-0.49 E + 09/ml) when compared with patients with moderate (1.03+/-0.29 E + 08/ml) and mild (1.76 +/-0.34 E + 08/ml) stages of inflammation. @	1
CONCLUSION The reduction of bacterial diversity with an increase in the total bacterial count indicates a shift of bacterial communities which signifies dysbiosis and dysanaerobiosis at the mucosal level for patients suffering from UC. @	1
BACKGROUND The healthy human intestine is represented by the presence of bacterial communities predominantly belonging to obligate anaerobes; however disparity and dysanaerobiosis in intestinal microflora may lead to the progression of ulcerative colitis (UC). `	0
The foremost aim of this study is to consider and compare the gut microbiota composition in patients suffering from different stages of UC. `	0
We extend the tools of higher-order Fourier analysis to analyze functions over general fields. `	1
Using these new tools, we revisit the results in the above areas. `	1
* For any fixed finite field $\mathbb{K}$, we show that the list decoding radius of the generalized Reed Muller code over $\mathbb{K}$ equals the minimum distance of the code. _	1
* For any fixed finite field $\mathbb{K}$, we give a polynomial time algorithm to decide whether a given polynomial $P: \mathbb{K}^n \to \mathbb{K}$ can be decomposed as a particular composition of lesser degree polynomials. _	1
* For any fixed finite field $\mathbb{K}$, we prove that all locally characterized affine-invariant properties of functions $f: \mathbb{K}^n \to \mathbb{K}$ are testable with one-sided error. @	1
Moreover, we show that for any fixed finite field $\mathbb{F}$, an affine-invariant property of functions $f: \mathbb{K}^n \to \mathbb{F}$, where $\mathbb{K}$ is a growing field extension over $\mathbb{F}$, is testable if it is locally characterized by constraints of bounded weight. @	1
Higher-order Fourier analysis, developed over prime fields, has been recently used in different areas of computer science, including list decoding, algorithmic decomposition and testing. `	0
Previously, this had been proved over prime fields [BL14] and for the case when $|\mathbb{K}|-1$ divides the order of the code [GKZ08]. _	0
This had been previously established over prime fields [Bha14, BHT15]. @	0
The same result was known when $\mathbb{K}$ is prime [BFHHL13] and when the property is linear [KS08]. @	0
AbstractWe propose a new combination of the bivariate Shepard operators [10] by the three point Lidstone polynomials introduced in [12] . `	1
The new combination inherits both degree of exactness and Lidstone interpolation conditions at each node, which characterize the interpolation polynomial. _	1
These new operators …nd application to the scattered data interpolation problem when supplementary second order derivative data are given [22] . @	0
Numerical comparison with other well known combinations are presented. @	0
In CF1 mice, superovulation has little effect on development to blastocyst, but enforces a greater degree of lineage restriction than natural breeding, most likely through constraints imposed by the zona pellucida. @	1
It remains controversial whether blastomeres of 2-cell stage mouse embryos show bias in their contribution to the blastocyst and whether there is any effect of superovulation. `	0
Two-cell stage embryos from CF1 mice were derived by either natural breeding (N) or superovulation (S) and cultured in vitro. `	0
At blastocyst, inner cell mass and trophectoderm were distinguished by Cdx2 and Oct4 immunostaining. `	0
A fluorescent dye (CM-Dil) was also used to tag individual blastomeres at the 2-cell stage, and the descendant cells identified by their red fluorescence. _	0
S and N embryos developed to blastocyst at the same rate and contained a similar number of cells. _	0
However, with S embryos, the descendants of the blastomere labeled with CM-DiI contributed predominantly to either the embryonic or abembryonic pole about 70% of the time, whereas most N embryos displayed random patterning, with no restriction to one or other of the poles. _	0
In S-embryos, but not N-embryos, the leading blastomere at second cleavage contributed preferentially to the embryonic pole of the blastocyst and the lagging blastomere to the abembryonic pole and hence mural trophectoderm. @	0
In addition, a tetrahedral rather than a flat morphology at the 4-cell stage of S-embryos was strongly biased to displaying the embryonic/abembryonic pattern at blastocyst. @	0
In contrast, S-embryos lacking a zona pellucida resembled N embryos in their patterning. @	0
METHODS A systematic search was performed using the electronic databases Pubmed and Embase. `	1
The psychometric properties of the questionnaires were determined based on the COSMIN taxonomy of measurement properties and definitions for health-related patient-reported outcomes and the COSMIN checklist using preset psychometric criteria. _	1
The Sydney Swallow Questionnaire (SSQ) proved to be identical to the Modified Self-report Symptom Inventory. _	1
All FHS questionnaires obtained poor overall methodological quality scores for most measurement properties. @	1
CONCLUSIONS The retrieved FHS questionnaires need psychometric reevaluation; if the overall methodological quality shows satisfactory improvement on most measurement properties, the use of the questionnaires in daily clinic and research can be justified. @	1
However, in case of insufficient validity and/or reliability scores, new FHS questionnaires need to be developed using and reporting on preestablished psychometric criteria as recommended in literature. @	1
INTRODUCTION Questionnaires on Functional Health Status (FHS) are part of the assessment of oropharyngeal dysphagia. `	0
OBJECTIVE To conduct a systematic review of the literature on the psychometric properties of English-language FHS questionnaires in adults with oropharyngeal dysphagia. `	0
RESULTS Three questionnaires were included: the Eating Assessment Tool (EAT-10), the Swallowing Outcome after Laryngectomy (SOAL), and the Self-report Symptom Inventory. _	0
Here, we report a shotgun proteomic analysis of P. profundum grown at atmospheric compared to high pressure using label-free quantitation and mass spectrometry analysis. _	1
We have identified differentially expressed proteins involved in high pressure adaptation, which have been previously reported using other methods. _	1
Proteins involved in key metabolic pathways were also identified as being differentially expressed. _	1
Proteins involved in the glycolysis/gluconeogenesis pathway were up-regulated at high pressure. _	1
Conversely, several proteins involved in the oxidative phosphorylation pathway were up-regulated at atmospheric pressure. @	1
Some of the proteins that were differentially identified are regulated directly in response to the physical impact of pressure. @	1
Photobacterium profundum SS9 is a Gram-negative bacterium, originally collected from the Sulu Sea. `	0
Its genome consists of two chromosomes and a 80 kb plasmid. `	0
Although it can grow under a wide range of pressures, P. profundum grows optimally at 28 MPa and 15°C. `	0
Its ability to grow at atmospheric pressure allows for both easy genetic manipulation and culture, making it a model organism to study piezophily. `	0
The expression of some proteins involved in nutrient transport or assimilation, are likely to be directly regulated by pressure. @	0
In a natural environment, different hydrostatic pressures represent distinct ecosystems with their own particular nutrient limitations and abundances. @	0
However, the only variable considered in this study was atmospheric pressure. @	0
METHODS We searched MEDLINE, PUBMED and EMBASE databases through July 2012, using search terms related to diabetes mellitus, cancer, and thyroid cancer. `	1
We conducted a meta-analysis of the risk of incidence of thyroid cancer from pre-existing diabetes. `	1
The risks were estimated using random-effects model and sensitivity test for the studies which reported risk estimates and used different definition of DM. _	1
RESULTS Compared with individuals without DM, the patients with DM were at 1.34-fold higher risk for thyroid cancer (95% CI 1.11-1.63). @	1
However, there was heterogeneity in the results (p<0.0001). @	1
Sensitivity tests and studies judged to be high quality did not show heterogeneity and DM was associated with higher risk for thyroid cancer in these sub-analyses (both of RRs = 1.18, 95% CIs 1.08-1.28). @	1
DM was associated with a 1.38-fold increased risk of thyroid cancer in women (95% CI 1.13-1.67) after sensitivity test. @	1
Risk of thyroid cancer in men did not remain significant (RR 1.11, 95% CI 0.80-1.53). @	1
CONCLUSIONS Compared with their non-diabetic counterparts, women with pre-existing DM have an increased risk of thyroid cancer. @	1
INTRODUCTION Diabetes mellitus (DM) is an important risk factor for endocrine cancers; however, the association with thyroid cancer is not clear. `	0
We performed a systematic review and meta-analysis to clarify the association between thyroid cancer and DM. `	0
Of 2,123 titles initially identified, sixteen articles met our inclusion criteria. _	0
An additional article was identified from a bibliography. _	0
Totally, 14 cohort and 3 case-control studies were selected for the meta-analysis. _	0
We describe a new tool, called PointCloudXplore (PCX), that supports effective 3D gene expression data exploration. `	1
PCX is a visualization tool that uses the established visualization techniques of multiple views, brushing, and linking to support the analysis of high-dimensional datasets that describe many genes’ expression. `	1
Each of the views in PointCloudXplore shows a different gene expression data property. _	1
We discuss on parallel coordinates as one example abstract data view currently available in PCX. @	1
We have developed several ex- tensions to standard parallel coordinates to facilitate brushing and the visualization of 3D gene expression data. @	1
PointCloudXplore: A Visualization Tool for 3D Gene Expression Data Oliver R¨ bel ∗,1,2 , Gunther H. Weber 2,3 , Soile V.E. `	0
Ker¨ nen 3 , Charless C. Fowlkes 4 , u a Cris L. Luengo Hendriks 3 , Lisa Simirenko 3 , Nameeta Y. Shah 2 , Michael B. Eisen 3 , Mark D. Biggin 3 , Hans Hagen 1 , Damir Sudar 3 , Jitendra Malik 4 , David W. Knowles 3 , and Bernd Hamann 1,2 International Research Training Group “Visualization of Large and Unstructured Data Sets,” University of Kaiserslautern, Germany Institute for Data Analysis and Visualization, University of California, Davis, CA, USA Life Sciences and Genomics Divisions, Lawrence Berkeley National Laboratory, Berkeley, CA, USA Computer Science Division, University of California, Berkeley, CA, USA Abstract: The Berkeley Drosophila Transcription Network Project (BDTNP) has de- veloped a suite of methods that support quantitative, computational analysis of three- dimensional (3D) gene expression patterns with cellular resolution in early Drosophila embryos, aiming at a more in-depth understanding of gene regulatory networks. `	0
Brushing is used to select and em- phasize data associated with deﬁned subsets of embryo cells within a view. _	0
Linking is used to show in additional views the expression data for a group of cells that have ﬁrst been highlighted as a brush in a single view, allowing further data subset properties to be determined. _	0
In PCX, physical views of the data are linked to abstract data displays such as parallel coordinates. _	0
Physical views show the spatial relationships between different genes’ expression patterns within an embryo. @	0
Abstract gene expression data displays on the other hand allow for an analysis of relationships between different genes directly in the gene expression space. @	0
∗ oliverruebel@web.de @	0
The proposed mathematical model is based on mixed-integer programming and helps minimizing the total cost. `	1
Total costs include the expenditure of establishing new centers, producing new products, cargo transport in the network, and disposal. _	1
Four types of tuned metaheuristic algorithms were used, which are hybrid forms of genetic and firefly algorithms. @	1
Computational results reveal that iterative sequentialization hybrid provides better solution compared with the other approaches in large size. @	1
This paper investigates a closed-loop supply chain network, including plants, demand centers, as well as collection centers, and disposal centers. `	0
In forward flow, the products are directly sent to demand centers, after being produced by plants, but in the reverse flow, reused products are returned to collection centers and, after investigating, are partly sent to disposal centers and the other part is resent to plants for remanufacturing. `	0
The model aims to answer these two questions. _	0
(1) What number and in which places the plants, collection centers, and disposal centers will be constructed. _	0
(2) What amount of products will be flowing in each segment of the chain, in order to minimize the total cost. @	0
Finally an adequate number of instances are generated to analyse the behavior of proposed algorithms. @	0
In this study, mouse strains carrying reporters linked to Pax3 alleles were used to map the fate of CNC cells in embryos which were either Pax3-sufficient (expressing one or two functional Pax3 alleles) or Pax3-deficient (expressing two null Pax3 alleles), and in which p53 had been inactivated or not. _	1
Migrating CNC cells were observed in both Pax3-sufficient and -deficient embryos, but CNC cells were sparse and disorganized in Pax3-deficient embryos as migration progressed. @	1
The defective migration was associated with increased cell death. @	1
Suppression of p53, either by null mutation of the p53 gene, or administration of a p53 inhibitor, pifithrin-alpha, prevented the defective CNC migration and apoptosis in Pax3-deficient embryos, and also restored proper development of cardiac outflow tracts. @	1
These results indicate that Pax3 is required for cardiac outflow tract septation because it blocks p53-dependent processes during CNC migration. @	1
During neural tube closure, Pax3 is required to inhibit p53-dependent apoptosis. `	0
Pax3 is also required for migration of cardiac neural crest (CNC) from the neural tube to the heart and septation of the primitive single cardiac outflow tract into the aorta and pulmonary arteries. `	0
Whether Pax3 is required for CNC migration and outflow tract septation by inhibiting p53-dependent apoptosis is not known. _	0
We used molecular data and phenotypic traits to unravel speciation processes and phylogeographic patterns in Aurelia.ResultsMitochondrial and nuclear DNA data (16S and ITS-1/5.8S rDNA) from 66 world-wide sampled specimens reveal star-like tree topologies, unambiguously differentiating 7 (mtDNA) and 8 (ncDNA) genetic entities with sequence divergences ranging from 7.8 to 14% (mtDNA) and 5 to 32% (ncDNA), respectively. _	1
Phylogenetic patterns strongly suggest historic speciation events and the reconstruction of at least 7 different species within Aurelia. _	1
Both genetic divergences and life history traits showed associations to environmental factors, suggesting ecological differentiation forced by divergent selection. @	1
Hybridization and introgression between Aurelia lineages likely occurred due to secondary contacts, which, however, did not disrupt the unambiguousness of genetic separation.ConclusionsOur findings recommend Aurelia as a model system for using the combined power of organismic, ecological, and molecular data to unravel speciation processes in cosmopolitan marine organisms. @	1
BackgroundThe cosmopolitan moon jelly Aurelia is characterized by high degrees of morphological and ecological plasticity, and subsequently by an unclear taxonomic status. `	0
The latter has been revised repeatedly over the last century, dividing the genus Aurelia in as many as 12 or as little as two species. `	0
Here we resolve these paradoxical findings and show that the capacity of LYVE-1 to bind HA is strictly dependent on avidity, demanding appropriate receptor self-association and/or HA multimerization. _	1
In particular, we demonstrate the prerequisite of a critical LYVE-1 threshold density and show that HA binding may be elicited in lymphatic endothelium by surface clustering with divalent LYVE-1 mAbs. @	1
In addition, we show that cross-linking of biotinylated HA in streptavidin multimers or supramolecular complexes with the inflammation-induced protein TSG-6 enables binding even in the absence of LYVE-1 cross-linking. @	1
Finally, we show that endogenous HA on the surface of macrophages can engage LYVE-1, facilitating their adhesion and transit across lymphatic endothelium. @	1
These results reveal LYVE-1 as a low affinity receptor tuned to discriminate between different HA configurations through avidity and establish a new mechanistic basis for the functions ascribed to LYVE-1 in matrix HA binding and leukocyte traffickingin vivo. @	1
The lymphatic endothelial receptor LYVE-1 has been implicated in both uptake of hyaluronan (HA) from tissue matrix and in facilitating transit of leukocytes and tumor cells through lymphatic vessels based largely onin vitrostudies with recombinant receptor in transfected fibroblasts. `	0
Curiously, however, LYVE-1 in lymphatic endothelium displays little if any binding to HAin vitro, and this has led to the conclusion that the native receptor is functionally silenced, a feature that is difficult to reconcile with its proposedin vivofunctions. `	0
Nonetheless, as we reported recently, LYVE-1 can function as a receptor for HA-encapsulated Group A streptococci and mediate lymphatic dissemination in mice. _	0
An inductive approach was used to develop probabilistic resource selection models using logistic regression to quantify the likelihood of hogs being in any area of the Department of Energy’s 805 km 2 Savannah River Site (SRS) in west-central South Carolina. `	1
The model’s significant parameters indicated that wild hogs preferred hardwoods and avoided pine and shrubby areas. _	1
