AbstractThis paper describes the parsing scheme in the <$Dm Dia l OG speech-to-speech dialog translation system, with special emphasis on the integration of speech and natural language processing. `	0
In this paper we present a novel technique for improving localization accuracy within a visual-inertial navigation system (VINS). _	1
We make use of training data to learn a model for the quality of visual features with respect to localization error in a given environment. _	1
This model maps each visual observation from a predefined prediction space of visual-inertial predictors onto a scalar weight, which is then used to scale the observation covariance matrix. @	1
In this way, our model can adjust the influence of each observation according to its quality. @	1
We discuss our choice of predictors and report substantial reductions in localization error on 4 km of data from the KITTI dataset, as well as on experimental datasets consisting of 700 m of indoor and outdoor driving on a small ground rover equipped with a Skybotix VI-Sensor. @	1
Navigation in unknown, chaotic environments continues to present a significant challenge for the robotics community. `	0
Lighting changes, self-similar textures, motion blur, and moving objects are all considerable stumbling blocks for state-of-the-art vision-based navigation algorithms. `	0
We give criteria for which a principal curvature becomes a bounded $C^\infty$-function at non-degenerate singular points of wave fronts by using geometric invariants. `	1
As applications, we study singularities of parallel surfaces and extended distance squared functions of wave fronts. _	1
Moreover, we relate these singularities to some geometric invariants of fronts. @	1
Here, a simple and novel one-pot synthetic strategy to prepare polystyrene (PS) hollow microspheres via irradiation-assisted free-radical polymerizing and self-assembly (IFPS) approach under γ-ray irradiation with no additives introduced into the system is presented. _	1
And PS/2,5-Diphenyloxazole (PPO) fluorescent microspheres have been prepared successfully by IFPS reaction, which can be used as scintillators for the detection of ionizing radiation. @	1
A linear relationship between emitted luminescence and dose-activity in water is obtained, which suggests that composite microspheres could be used as liquid scintillation in specific environment. @	1
To simply and multitudinously synthesize hollow microspheres in a pure system is important for relevant research and application. `	0
In this paper, we give a simple proof of the mathematical equivalence of barrier crossing, peak-background split, and local biasing. @	1
Several, apparently distinct, formalisms exist in the literature for predicting the clustering of dark matter halos. `	0
It has been noticed on a case-by-case basis that the predictions of these different methods agree in specific examples, but there is no general proof that they are equivalent. _	0
Cryoprobes can be used for performing tissue biopsies. `	1
The overall diagnostic yield was 60.5% and, in the lesions reached by EBUS, it was 74.2%. _	1
In 19 cases, the diagnosis was made with forceps as well as cryobiopsy and, in four cases, only with cryobiopsy. @	1
Cryobiopsies were significantly larger than forceps biopsies (11.17 mm(2) versus 4.69 mm(2), p<0.001). @	1
We observed one case of moderate bleeding. @	1
Transbronchial cryobiopsy with EBUS guidance is safe and useful to obtain histological samples. @	1
Larger tissue samples can be obtained by cryoprobe. @	1
Peripheral lung lesions are sometimes difficult to reach even with endobronchial ultrasound (EBUS) and insufficient material is often obtained by transbronchial forceps biopsy. `	0
We evaluated the safety and feasibility of the cryoprobe in combination with EBUS for the diagnosis of peripheral lung lesion. `	0
Patients with peripheral lung lesions of up to 4 cm were enrolled. `	0
After identifying the lung lesion by radial EBUS, forceps biopsies and cryobiopsies were performed in a randomised order. _	0
We evaluated safety and feasibility, and compared diagnostic yield and sample size. _	0
39 patients were randomised and the peripheral lung lesion was reached in 31. _	0
In this paper, we survey recent progress on the theory of maximally monotone operators in general Banach space. `	1
We also extend various of the results and leave some open questions. _	1
Forty isolates were found to be either resistant, or intermediate, to erythromycin (3.2% of isolates); of these, more than 50% were identified as S. epidermidis. _	1
A total of 15 (1.2%) resistant isolates of staphylococci originated from foodstuffs. _	1
Resistance mediated by methylation – i.e. _	1
iMLSB-resistance (10 isolates with the erm(A) or erm(C) gene) and constitutive MLSB-resistance (one isolate with the erm(B) and erm(C) genes) – exhibited a significantly high level of resistance to erythromycin with minimum inhibitory concentrations (MIC) of 64 – >128 mg/l (MICmode = >128 mg/l). _	1
In contrast, the efflux mechanism encoded by the msr(A) gene (13 isolates; MICrange = 4–128, MICmode = 128 mg/l), the inactivation mechanisms of resistance encoded by the mph(C) gene (three isolates; MICrange = 8–32 mg/l), and/or their combination (13 isolates; MICrange = 4–128, MICmode = 64 mg/l) led to lower MIC values. @	1
The efflux gene msr(A) dominated among the erythromycin-resistant isolates (65% of resistant isolates). @	1
This first report on the resistance of Staphylococcus spp. @	1
to erythromycin in the Czech Republic illustrates that, while occurrence was low, isolates from food were nevertheless carriers of erm(A), erm(B), erm(C), msr(A) and mph(C) genes for resistance to erythromycin and, therefore, represent a potential thread to humans. @	1
The aim of this study was to determine both the occurrence and the genetic basis of resistance to erythromycin among 1 235 Staphylococcus spp. `	0
isolates obtained between 2000 and 2006 from (a) raw milk and meat (1 704 samples), (b) foodstuffs produced from these (451 samples), and (c) contact surfaces at processing plants and dairy farms (363 samples) in the Czech Republic. `	0
Isolates were screened by broth microdilution method for resistance to erythromycin and further 11 antimicrobial agents. `	0
In addition, isolates were screened by agar dilution (erythromycin range 1–128 mg/l) and D-zone test for inducible resistance to macrolides, lincosamides and streptogramin B (iMLSB). `	0
Results indicated that parent-reported patient behavioral problems accounted for a significant 26% of variance in family functioning. _	1
Post-hoc analysis revealed that externalizing behavior problems accounted for the majority of this variance compared to internalizing behavior problems. _	1
These results suggest that externalizing problems may have a more significant impact on these families than previous research indicates. @	1
Moreover, externalizing behaviors may significantly impact family adaptation and should be taken into consideration during routine clinical care. @	1
The objective of this study was to examine the relative contributions of both parental and adolescent functioning to family functioning in adolescent patients with inflammatory bowel disease (IBD) and their families. `	0
Participants were 45 adolescents (27 male, 18 female) 13–17 years old (M = 15.41 years, SD = 1.32) with IBD and their parents. `	0
Families completed measures of patient behavioral functioning and depression, parent distress and family functioning. `	0
Disease severity assessments were completed via data provided by patients’ gastroenterologists. _	0
Further research is needed to replicate and expand upon these findings. @	0
Design options are compared considering different scanning and signaling procedures to evaluate access delay and system overhead. _	1
The channel structure and multiple access issues are also considered. @	1
The analysis demonstrates significant benefits of low-resolution fully digital architectures in comparison to single stream analog beamforming. @	1
The millimeter wave (mmWave) bands have recently attracted considerable interest for next-generation cellular systems due to the massive available bandwidths at these frequencies. `	0
However, a key challenge in designing mmWave cellular systems is initial access -- the procedure by which a mobile establishes an initial link-layer connection to a base station cell. `	0
MmWave communication relies on highly directional transmissions and the initial access procedure must thus provide a mechanism by which initial transmission directions can be searched in a potentially large angular space. _	0
In the present study, non-obese and non-diabetic patients were selected, so that any lipid metabolic abnormalities that were seen were not due to any metabolic syndrome. _	1
Although no insulin resistance was found in the olanzapine treatment group, high levels of triglyceride and RLP-cholesterol were induced by the glucose tolerance cookie test. @	1
This suggests that olanzapine has a direct action on lipid metabolism even after relatively short treatment duration (3–24 weeks). @	1
In contrast to the study by Henderson et al (2005), the present study in non-obese, non-diabetic subjects found no difference between patients treated with olanazpine and risperidone in fasting insulin levels which were all within the normal range. @	1
A possible reason for this difference between the studies may be the duration of drug treatment. @	1
In the Henderson study, the mean duration of treatment with olanzapine was 29.5 months, whereas it was only 12.3 weeks in the present study. @	1
Another possibility is the influence of racial differences. @	1
Asian people have reduced insulin secretion compared with Caucasians (Sasahara et al 2004), making it theoretically more difficult to detect metabolic abnormalities from fasting blood samples. @	1
This could explain why insulin resistance was not detected in our group of Japanese patients. @	1
The glucose tolerance test is clearly useful for earlier detection of lipid metabolic abnormalities. @	1
This is especially true for Japanese patients who have reduced insulin secretion compared with Caucasians and their metabolic abnormalities are not easily detected by conventional markers. @	1
Higher levels of RLP-cholesterol have recently been suggested to be a risk factor for arteriosclerosis (Takeichi et al 1999). @	1
In a 3-year follow-up study of patients with coronary artery disease, patients with higher RLP-cholesterol (>5.1 mg/dL) had a significantly greater risk of developing coronary events than lower RLP-cholesterol patients (<3.3 mg/dL) (Kugiyama et al 1999). @	1
The present study suggests that patients treated with olanzapine should be routinely tested using the glucose tolerance cookie test to determine RLP-cholesterol level as a risk marker for the development of coronary events. @	1
In clinical practice, the high incidence of metabolic abnormalities, such as diabetes and hyperlipidemia, seen in schizophrenic patients are the result of a complex interaction of a number of factors, including lifestyle, overactivity of the hypothalamic-pituitary-adrenal axis, and antipsychotic medication. `	0
Antipsychotic-induced metabolic abnormalities have been thought to be due to insulin resistance caused by obesity, which is a major side-effect of antipsychotics. `	0
However, there is increasing evidence that second-generation antipsychotics can also have direct metabolic effects. `	0
We investigated two similar groups of 9 non-obese, non-diabetic Japanese schizophrenic patients taking either risperidone or olanzapine as monotherapy for 3–66 weeks with no changes in their treatment for at least 3 weeks. `	0
The published Japanese definitions for obesity (BMI >25, waist measurement at umbilicus level >85 cm for males, >90 cm for females) and diabetes (fasting glucose > 110 mg/dL) were used (Matsuzawa et al 2005). `	0
Metabolic markers (glucose, insulin, triglycerides, total cholesterol, and high-density lipoprotein cholesterol) were measured in blood samples taken after 12 h fasting. `	0
Subjects then ingested a 110 g glucose tolerance test cookie (Harano et al 2006) and blood was taken 2 h later for measurement of glucose, insulin, triglycerides, and remnant-like lipoprotein particles (RLP) cholesterol levels. `	0
Insulin resistance was assessed by the homeostasis model assessment of insulin resistance (HOMA-IR) (Emoto et al 1999). `	0
RLP were measured as the unbound serum fraction in an immuno-affinity mixed gel using monoclonal antibodies to apoA-I and apoB100 (Nakajima et al 1996). `	0
RLP-cholesterol levels were determined as the cholesterol fraction. `	0
Fasting values and those obtained 2 h after the glucose tolerance test are shown in Table 1. `	0
Plasma glucose levels remained within normal limits for both groups although those in the olanzapine group were significantly increased after the test compared with fasting levels. `	0
Insulin levels were significantly increased to a similar extent in both groups after the glucose tolerance test. `	0
No insulin resistance was seen in any patient. _	0
Table 1    Carbohydrate and lipid metabolism markers        The triglyceride levels were significantly increased compared to fasting levels in the olanzapine group but not in the risperidone group. _	0
The value over the normal limit (>150 mg/dL) indicates that lipid metabolic abnormalities may occur in the olanzapine group. _	0
In addition, the level of RLP-cholesterol in the olanzapine group was also significantly increased compared to the risperidone group. _	0
Higher fasting serum insulin levels have been found in schizophrenic patients treated with clozapine compared with those treated with conventional antipsychotics, suggesting possible insulin resistance (Melkersson et al 1999). _	0
Similarly treatment with olanzapine resulted in elevated serum insulin levels compared to baseline values in a 5-month study (Melkersson et al 2000). _	0
These studies suggest that certain antipsychotics can induce insulin resistance. _	0
It is not clear, however, from these studies whether the effect results from metabolic syndromes, such as weight gain and obesity, or a direct effect. _	0
Evidence for a direct effect is accumulating. _	0
A recent study of non-obese, non-diabetic schizophrenics showed elevated fasting insulin levels with clozapine and olanzapine (Henderson et al 2005). _	0
In this study, insulin resistance was significantly reduced in patients on clozapine or olanzapine compared with those on risperidone. _	0
In addition, in vitro studies have shown a direct effect of clozapine and olanzapine but not conventional antipsychotics on the stimulation of insulin secretion from pancreatic β-cells (Melkersson 2004). _	0
Based on the Merkle signature scheme and Winternitz one-time signatures we propose a signature scheme with bounded side-channel leakage that is secure in a post-quantum setting. _	1
Novel algorithmic improvements for the authentication path computation bound side-channel leakage and improve the average signature computation time by close to 50 % when compared to state-of-the-art algorithms. @	1
The proposed scheme is implemented on an Intel Core i7 CPU and an AVR ATxmega microcontroller with carefully optimized versions for the respective target platform. @	1
The theoretical algorithmic improvements are verified in the implementations and cryptographic hardware accelerators are used to achieve competitive performance.Keywords. @	1
hash-based cryptography, signatures, side-channel leakage, software, microcontroller, post-quantum cryptography @	1
Abstract. `	0
Digital signatures have become a key component of many embedded system solutions and are facing strong security and efficiency requirements. `	0
At the same time side-channel resistance is essential for a signature scheme to be accepted in real-world applications. _	0
In this study, we show that Col2a1-Cre-driven deletion of Shox2 in developing chondrocytes also results in shortening of the stylopodial skeleton (i.e. `	1
humerus, femur) and that this rhizomelia is due to precocious chondrocyte maturation and hypertrophy. _	1
We demonstrate, using the micromass culture model system, that increased BMP activity triggers accelerated maturation and hypertrophy in Col2a1-Cre Shox2 mutant chondrocytes and we confirm in vivo that elevated transcript levels and expanded expression domains of Bmp2 and 4 are associated with premature formation of the hypertrophic zone in mutant humeri. _	1
In micromass cultures of Prrx1-Cre Shox2 mutant limb cells, we find that Shox2 deletion in undifferentiated mesenchymal cells results in increased BMP activity that enhances early chondrogenesis, but is insufficient to provoke chondrocyte maturation and hypertrophy. _	1
Similarly, shRNA-mediated Shox2 knockdown in multipotent C3H10T1/2 cells and primary mouse bone marrow mesenchymal stem cells results in spontaneous chondrogenesis in the absence of chondrostimulation, but again fails to induce progression through the later stages of chondrogenic differentiation. @	1
Importantly, exogenous BMP supplementation can overcome the block to maturation and hypertrophy caused by Shox2 depletion prior to overt chondrogenesis. @	1
Thus, we provide evidence that Shox2 regulates progression through chondrogenesis at two distinct stages--the onset of early differentiation and the transition to maturation and hypertrophy. @	1
In humans, loss of SHOX gene function is responsible for the mesomelic short stature characteristic of Turner syndrome, Leri-Weill dyschondrosteosis, and Langer dysplasia. `	0
In a mouse model of SHOX deficiency, Prrx1-Cre-driven limb-specific deletion of the paralogous gene Shox2 results in severe rhizomelia. `	0
Pre-operative computed tomography scans revealed a large complex cystic and solid mass in the tail of the pancreas; the patient underwent a laparoscopic spleen-preserving left pancreatectomy. _	1
The tumor was shown to be made of cystic and solid components, with a grossly grey/ white appearance. _	1
A histological evaluation of the tumor revealed two elements separated from each other, one component was a pancreatic ductal adenocarcinoma and the other component exhibited a sarcomatous growth pattern, composed of spindle cells and multinucleated giant cells. @	1
Immunohistochemically, the epithelial area was positive for cytokeratin (CK) and negative for vimentin, while the sarcomatoid area was negative for CK and positive for vimentin. @	1
These observations confirmed a diagnosis of pancreatic carcinosarcoma. @	1
Although the patient was treated by gemcitabine following surgery, the outcome was extremely poor and the patient succumbed to sarcomatoid carcinoma three months after the treatment. @	1
Sarcomatoid carcinoma of the pancreas is extremely rare. `	0
The current report presents a case of carcinosarcoma of the pancreas in a 48-year-old male. `	0
Skewed age and sex ratios may reflect varying vulnerability to capture, through differences in behaviour or segregation in populations. _	1
Adult females constituted the second largest portion of the bycatch for both species, with potential consequences for population sustainability. @	1
Depth was the most important parameter influencing bycatch of both species and reflected what is known about common and striped dolphin habitat use in the region as the probability of catching common dolphins decreased, and striped dolphins increased, with increasing depth. @	1
Striped dolphin capture was similarly influenced by the extent to which operations were conducted in daylight, with the probability of capture increasing with increased operations in the pre-sunset and post-sunrise period, potentially driven by increased ability of observers to record animals during daylight operations, or by diurnal movements increasing contact with the fishery. @	1
Effort, based on net length and soak time, had little influence on the probability of capturing either species. @	1
Our results illustrate the importance of assessing the demographic of the animals captured during observer programmes and, perhaps more importantly, suggest that effort restrictions alone may not be sufficient to eradicate bycatch in areas where driftnets and small cetaceans co-occur. @	1
Fisheries bycatch is a key threat to cetacean species globally. `	0
Managing the impact requires an understanding of the conditions under which animals are caught and the sections of the population affected. `	0
We used observer data collected on an albacore tuna gillnet fishery in the northeast Atlantic, to assess operational and environmental factors contributing to bycatch of common and striped dolphins, using generalised linear models and model averaging. `	0
Life history demographics of the captured animals were also investigated. `	0
In both species, young males dominated the catch. _	0
The age ratio of common dolphins was significantly different from that estimated for the population in the region, based on life tables (G = 17.1, d.f. _	0
= 2, p = 0.002). _	0
RESULTS At 15 months after treatment initiation, 85 patients (32%) were considered excellent responders; 92 (36%), intermediate responders; and 85 (32%), poor responders. _	1
Compared with an intermediate or poor response, an excellent response was associated with lower baseline disability score (range, 0-3 points, with 0 being the best score; adjusted odds ratio [OR] per point increase, 0.49; 95% CI, 0.33-0.74); fewer disease-modifying antirheumatic drugs (DMARD) (including methotrexate) used before initiating etanercept (adjusted OR per DMARD used, 0.64; 95% CI, 0.43-0.95), and younger age at onset (adjusted OR per year increase, 0.92; 95% CI, 0.84-0.99). _	1
Compared with an intermediate or excellent response, a poor response was associated with systemic JIA (adjusted OR systemic vs nonsystemic categories, 2.92; 95% CI, 1.26-6.80), and female sex (adjusted OR female vs male, 2.16; 95% CI, 1.12-4.18). _	1
Within the first 15 months of etanercept treatment, 119 patients experienced 1 or more infectious, noninfectious, or serious adverse events, including 37 among those with an excellent response, 36 with an intermediate response, and 46 with a poor response. _	1
Within the first 15 months of treatment, 61 patients discontinued etanercept treatment, including 4 with an excellent response, 0 with an intermediate response, and 57 with a poor response. @	1
In a secondary analysis of 262 patients with a median follow-up of 35.6 months after initiation of etanercept, a range of 37% to 49% of patients reached inactive disease. @	1
The mean adherence to etanercept was 49.2 months (95% CI, 46.4-52.0) for patients with an excellent response after 15 months, 47.5 months (95% CI, 44.9-50.1) for patients with an intermediate response, and 17.4 months (95% CI, 13.6-21.2) for patients with a poor response. @	1
CONCLUSIONS Among patients with JIA who initiated treatment with etanercept, one-third achieved an excellent response, one-third an intermediate response, and one-third a poor response to therapy. @	1
Achievement of an excellent response was associated with low baseline disability scores, DMARDs used before initiating etanercept, and younger age at onset of JIA. @	1
Achievement of a poor treatment response was associated with systemic JIA and female sex. @	1
CONTEXT Since the introduction of biologic therapies, the pharmacological treatment approach for juvenile idiopathic arthritis (JIA) has changed substantially, with achievement of inactive disease as a realistic goal. `	0
OBJECTIVE To determine the response to therapy after initiation of etanercept therapy among patients with JIA and to examine the association between baseline factors and response to etanercept treatment. `	0
DESIGN, SETTING, AND PATIENTS The Arthritis and Biologicals in Children Register, an ongoing prospective observational study since 1999, includes all Dutch JIA patients who used biologic agents. `	0
All biologically naive patients who started etanercept before October 2009 were included, with follow-up data to January 2011. `	0
Among the 262 patients, 185 (71%) were female, 46 (18%) had systemic-onset, and the median age at initiation of etanercept treatment was 12.4 years. `	0
MAIN OUTCOME MEASURES Excellent response (inactive disease or discontinuation earlier due to disease remission), intermediate response (more than 50% improvement from baseline, but no inactive disease), and poor response (less than 50% improvement from baseline or discontinuation earlier due to ineffectiveness or intolerance) evaluated 15 months after initiation of etanercept. _	0
In this paper, we provide the in-depth theoretical analysis needed to understand and properly apply the WCM framework. `	1
We focus on general absorbing sets of type two (GASTs). _	1
In particular, we introduce a novel tree representation of a GAST called the unlabeled GAST tree, using which we prove that the WCM framework is optimal. _	1
Then, we enumerate the WCMs. _	1
We demonstrate the significance of the savings achieved by the WCM framework in the number of matrices processed to remove a GAST. _	1
Moreover, we provide a linear-algebraic analysis of the null spaces of WCMs associated with a GAST. @	1
We derive the minimum number of edge weight changes needed to remove a GAST via its WCMs, along with how to choose these changes. @	1
Additionally, we propose a new set of problematic objects, namely the oscillating sets of type two (OSTs), which contribute to the error floor of NB-LDPC codes with even column weights on asymmetric channels, and we show how to customize the WCM framework to remove OSTs. @	1
We also extend the domain of the WCM framework applications by demonstrating its benefits in optimizing column weight 5 codes, codes used over Flash channels with soft information, and spatially-coupled codes. @	1
