The comparison of the upstream nucleotide sequence of Pgp1 with those of 37 other genes including those involved in the CO2-concen- trating mechanism and (or) photorespiration showed the high similarity of Pgp1 upstream to a periplasmic carbonic anhydrase gene Cah1; the motifs RAGGTCAGN8-9CCR and TTGGCAG were found only within the low-CO2 respon- sive genes, including Pgp1 and Cah1. _	1
GAN7CGNTTGGAAN2AG, TTGGAAGGAG, and CAGAGGTCAGN8CCG were found only with Pgp1 and Cah1, and ACGCTTGGCAGT and CATTACCAT were found only with Pgp1 and alanine aminotransferase gene Aat1. @	1
The possibility of functional PGPase isozyme(s) in C. reinhardtii is also discussed. @	1
RESULTS Viewpoints quantity of the Scientific Products Mazandaran University of Medical Sciences stands first and of Babol University of Medical Sciences ranks the end, but from the viewpoints of quality of scientific products of considering the H-Index and the number of cited papers the Mazandaran University of Medical Sciences is a head from the other universities under study. @	1
From the viewpoints of subject of the papers, the highest scientific products belonged to the faculty of Pharmacy affiliated to Mazandaran University of Medial Sciences, but the three other universities for the genetics and biochemistry. @	1
CONCLUSION Results showed that the Mazandaran University of Medical Sciences as compared to the other understudies universities ranks higher for the number of articles, cited articles, number of hard work authors and H-Index of Scopus database from 2005 through 2010. @	1
CONFLICT OF INTEREST NONE DECLARED. `	0
INTRODUCTION The study of the scientific evidence citation production by famous databases of the world is one of the important indicators to evaluate and rank the universities. `	0
The study at investigating the scientific production of Northern Iran Medical Sciences Universities in Scopus from 2005 through 2010. _	0
METHOD This survey used scientometrics technique. _	0
The samples under studies were the scientific products of four northern Iran Medical universities. @	0
Over 85% of H3K27me3 marked promoters were bivalent in human and mouse ES cells. _	1
We found that (i) HC bivalent promoters were enriched for developmental factors and were highly likely to be differentially expressed upon transcription factor perturbation; (ii) murine HC bivalent promoters were occupied by both polycomb repressive component classes (PRC1 and PRC2) and grouped into four distinct clusters with different biological functions; (iii) HC bivalent and active promoters were CpG rich while H3K27me3-only promoters lacked CpG islands. _	1
Binding enrichment of distinct sets of regulators distinguished bivalent from active promoters. @	1
Moreover, a 'TCCCC' sequence motif was specifically enriched in bivalent promoters. @	1
Finally, this analysis will serve as a resource for future studies to further understand transcriptional regulation during embryonic development. @	1
In embryonic stem (ES) cells, developmental regulators have a characteristic bivalent chromatin signature marked by simultaneous presence of both activation (H3K4me3) and repression (H3K27me3) signals and are thought to be in a 'poised' state for subsequent activation or silencing during differentiation. `	0
We collected eleven pairs (H3K4me3 and H3K27me3) of ChIP sequencing datasets in human ES cells and eight pairs in murine ES cells, and predicted high-confidence (HC) bivalent promoters. `	0
We find that the actual structures are more complex than what had been previously thought, and that there is a strong shear deformation type structural instability which modifies the properties. `	1
Specifically, we find that normal tensile strain leads to structural instabilities with a large induced shear deformation in (001) BiFeO3 thin films. _	1
These induced shear deformations in (001) BiFeO3 thin films under tension stabilize the (001) BiFeO3 thin films and lead to Cc and Ima2 phases that are more stable than the Pmc21 phase at high tensile strain. _	1
The induced shear deformation shifts the Cc to Ima2 phase transition towards lower tensile strain region (~1% less), prevents monoclinic tilt and oxygen octahedral tilts, and increases the ferroelectric polarization. @	1
The induced shear deformation also strongly affects the electronic structure. @	1
The results are discussed in relation to growth of BiFeO3 thin films on cubic and tetragonal substrates involving high levels of tensile strain. @	1
We explore BiFeO3 under tensile strain using first-principles calculations. `	0
We report that a single Yellow Bullhead ( Ameiurus natalis ) was collected from Silvermere Lake in the Lower Fraser River drainage. `	1
This represents the first record of the Yellow Bullhead in western Canada, and its introduction likely was accidental with a shipment of Largemouth Bass ( Micropterus salmoides ) rather than dispersal from Washington. _	1
Warm, eutrophic, weedy habitat in the Fraser Delta provides ample habitat for Yellow Bullheads and other exotic fishes. _	1
A Blue-eyed Panaque ( Panaque suttonorum ), a loricariid catfish found in 1995 in Shawnigan Lake, Vancouver Island, probably represents a single, illegally released aquarium fish, as does a large Silver Pacu ( Piaractus cf. @	1
P. brachypomus ), which was found in Green Lake on Vancouver Island in 2004. @	1
In Canada, there are no native catfish west of the continental divide and until recently, the list of extant exotic catfishes in British Columbia only included introduced Black Bullhead ( Ameiurus melas ) and Brown Bullhead ( Ameiurus nebulosus ). `	0
The results show that prior to ABMT the proportion of patients with protective immunity against poliomyelitis, tetanus and diphtheria was similar to that of controls. `	1
At study entry 4–10 years after ABMT, the proportion of patients with protective immunity against poliomyelitis and diphtheria was reduced, while all patients maintained protection against tetanus. _	1
A significant decrease in geometric mean antibody concentrations or titres was observed against all three antigens during this period. _	1
Serum levels of antibodies against different pneumococcal serotypes were lower in the patients than in the controls prior to vaccination. _	1
Unlike controls, a minority of patients achieved protective levels of antibodies after a single vaccination. @	1
Despite persistent levels of protective antibodies in many patients post ABMT, secondary booster responses after one vaccination with T cell-dependent vaccines (tetanus, diphtheria and polio) were absent. @	1
In conclusion, this study shows that post ABMT, a full re-vaccination program was necessary to mount responses comparable to those observed after a single vaccination in controls. @	1
The aim of this study was to investigate the late effects of ABMT on the immune system with regard to protective humoral immunity against common antigens and responses to recall antigens (vaccines). `	0
The vaccines were given according to EBMT guidelines from 1995. `	0
The protocol included 35 patients with malignant lymphoma in CR 4–10 years after ABMT, and 35 controls. `	0
The responses to pneumococcal vaccination, which is considered to be a T cell-independent vaccine, were studied. _	0
Bone Marrow Transplantation (2001) 28, 681–687. @	0
In our work we investigate Witt equivalence of general function fields over global fields. `	1
It is proven that for any two such fields K and L the Witt equivalence induces a canonical bijection between Abhyankar valuations on K and L having residue fields not finite of characteristic 2. _	1
The main tool used in the proof is a method of constructing valuations due to Arason, Elman and Jacob. @	1
Numerous applications are provided, in particular to Witt equivalence of function fields over number fields: it is proven, among other things, that for two number fields k and l the Witt equivalence between the fields k(x_1,...,x_n) and l(x_1,...,x_n) implies that k and l are themselves Witt equivalent and have equal 2-ranks of their ideal class groups. @	1
Overall, oseltamivir treatment showed a survival benefit, with the greatest benefit shown in H5N1 cases who were treated within two days of symptom onset (51% reduction in case fatality). @	1
CONCLUSION Since prompt treatment with antivirals conferred a strong survival benefit for H5N1 cases, presumptive antiviral treatment should be considered for all possible cases presenting during an outbreak of H5N1 as a potentially life-saving measure. @	1
INTRODUCTION The goal of this study was to evaluate whether any characteristics that are evident at presentation for urgent medical attention could be used to differentiate cases of H5N1 in the absence of viral testing. `	0
METHODOLOGY Information about exposure to poultry, clinical signs and symptoms, treatments, and outcomes was abstracted from existing data in the global avian influenza registry (www.avianfluregistry.org) using standardized data collection tools for documented and possible cases of H5N1 infection who presented for medical attention between 2005-2011 during known H5N1 outbreaks in Azerbaijan, Indonesia, Pakistan and Turkey. `	0
RESULTS Demography, exposure to poultry, and presenting symptoms were compared, with only the common symptoms of fever and headache presenting significantly more frequently in confirmed H5N1 cases than in possible cases. _	0
Reported exposure to  infected humans was also more common in confirmed cases. _	0
In contrast, unexplained respiratory illness, sore throat, excess sputum production, and rhinorrhea were more frequent in possible cases. @	0
We have shown that extrathyroidal extension is significantly associated with the presence of “plump pink”cells (p=0.0019), well developed nuclear features of PTC (p=0.018) and tumor associated stromal reaction (fibrosis/dezmoplazia/sclerosis) (p<0.0001). @	1
Other parameters were more prevalent among PTMC foci with extrathyroidal extension, but did not reach statistical significance. @	1
Conclusion: Our results pointed out the importance of a distinct set of morphological microscopical parameters, predictive for extrathyroidal extension in PTMC cases (“plump pink” cells, well developed PTC nuclear features, tumor associated stromal reaction, infiltrative tumor borders and conventional PTC histology). @	1
All these parameters are important to be mentioned in the histopathological reports, as they might be associated with a more aggressive biological behaviour. @	1
Abstract Introduction: In this study, we aimed to investigate the importance of some distinctive morphological parameters in predicting the extrathyroidal extension, as marker of aggressiveness, in a series of papillary thyroid microcarcinoma (PTMC) cases. `	0
Material and methods: All consecutive PTMC cases, sized ≥ 5mm, registered at the Department of Pathology, Tîrgu-Mureș Emergency County Hospital from January 2002 to December 2013 were re-evaluated. `	0
The following histological features were noted: the multifocality, the extrathyroidal extension, the histologic variant, the tumor’s border (well circumscribed versus infiltrative), the PTC nuclear features (well developed versus subtle), the tumor associated stromal reaction (fibrosis/desmoplasia/sclerosis versus none of these changes), the presence of “plump pink” cells, psammoma bodies, intratumoral lymphocytic infiltrate, cystic change, back-to-back arrangement, intratumoral multinucleated giant cells and lymph node involvement. _	0
Results: Our study included 72 PTMC cases, summing up to a total of 80 PTMC foci. _	0
We pose the following general dual Orlicz-Minkowski problem: {\it Given a nonzero finite Borel measure $\mu$ defined on $S^{n-1}$ and a continuous function $\phi: \mathbb{R}^n\setminus\{o\}\rightarrow (0, \infty)$, can one find a constant $\tau>0$ and a convex body $K$ (ideally, containing $o$ in its interior), such that,} $$\mu=\tau\widetilde{C}_{\phi,\mathcal{V}}(K,\cdot)? _	1
$$ Based on the method of Lagrange multipliers and the established variational formula for the general dual ($L_{\phi})$ Orlicz quermassintegral, a solution to the general dual Orlicz-Minkowski problem is provided. @	1
In some special cases, the uniqueness of solutions is proved and the solution for $\mu$ being a discrete measure is characterized. @	1
For $K\subseteq \mathbb{R}^n$ a convex body with the origin $o$ in its interior, and $\phi:\mathbb{R}^n\setminus\{o\}\rightarrow(0, \infty)$ a continuous function, define the general dual ($L_{\phi})$ Orlicz quermassintegral of $K$ by $$\mathcal{V}_\phi(K)=\int_{\mathbb{R}^n \setminus K} \phi(x)\,dx.$$ Under certain conditions on $\phi$, we prove a variational formula for the general dual ($L_{\phi})$ Orlicz quermassintegral, which motivates the definition of $\widetilde{C}_{\phi,\mathcal{V}}(K, \cdot)$, the general dual ($L_{\phi})$ Orlicz curvature measure of $K$. `	0
RESULTS Expression-based grouping produced a significant finding of association between the L(A) allele and adverse effect burden in the entire sample (P = .004 [genotype frequency]; P < .001 [allele frequency]). _	1
To control for bias from population stratification, a white American subsample was analyzed. _	1
A lesser adverse effect burden was associated with L(A)L(A) genotype frequency (P = .03) or L(A) allele frequency (P = .007). @	1
These findings in white patients did not hold when the L allele was undifferentiated. @	1
No association was observed between treatment outcome phenotypes and HTTLPR. @	1
Development of diarrhea and the presence of the low-expression S or L(G) alleles were the strongest risk factors associated with adverse effect burden. @	1
CONCLUSIONS The HTTLPR polymorphism is associated with citalopram adverse effects. @	1
Because the L(A) allele confers increased SLC6A4 transcription, increased serotonin transporter levels in brain and other tissues may lead to fewer adverse effects for antidepressant medications that target the transporter. @	1
CONTEXT The HTTLPR, a functional polymorphism of the serotonin transporter gene solute carrier family 6 (neurotransmitter transporter, serotonin), member 4 (SLC6A4), promoter, affects transcription and may be involved in antidepressant drug treatment outcome, although response rates with antidepressants can be lower in patients who experience adverse effects. `	0
OBJECTIVE To test the hypothesis that HTTLPR is associated with treatment outcome to citalopram. `	0
DESIGN A clinical effectiveness trial, Sequenced Treatment Alternatives to Relieve Depression, collected DNA samples from outpatients with nonpsychotic major depressive disorder who received citalopram in the first treatment step. `	0
The triallelic HTTLPR locus was genotyped in 1775 samples to discriminate between long (L) and short (S) alleles, followed by the A > G substitution. `	0
The low-expression S and L(G) alleles were grouped together compared with the high-expression L(A) allele. `	0
SETTING Eighteen primary care and 23 psychiatric care sites across the United States. _	0
PARTICIPANTS Ages 18 to 75 years, meeting criteria for single or recurrent nonpsychotic major depression. _	0
MAIN OUTCOME MEASURES Categorical response, remission, tolerance, and adverse effect burden. _	0
In this paper some of these findings -- those for $k=1$ and $k=2$ -- are extended to polynomials featuring one double root; and a few representative examples are reported of new solvable systems of nonlinear evolution equations. @	1
Recently new solvable systems of nonlinear evolution equations -- including ODEs, PDEs and systems with discrete time -- have been introduced. `	0
These findings are based on certain convenient formulas expressing the $k$-th time-derivative of a root of a time-dependent monic polynomial in terms of the $k$-th time-derivative of the coefficients of the same polynomial and of the roots of the same polynomial as well as their time-derivatives of order less than $k$. _	0
These findings were restricted to the case of generic polynomials without any multiple root. @	0
IL-1α also induced enhancement in the expression of uPA/uPAR in pancreatic cancer cells. _	1
IL-1α enhanced the proliferation, adhesion, and migration in pancreatic cancer cells, and IL-1α-induced alterations of uPA/uPAR expression correlated with the increased the migration of pancreatic cancer cells. _	1
Upregulation of α6 integrin subunit and uPA/uPAR correlated with the activation of Ras and downstream extracellular signal-regulated kinase (ERK) pathways. _	1
IL-1α-induced activation of Ras and downstream ERK can be inhibited by using inhibitory antibodies against α6 and β1 integrin and uPAR, consistent with the inhibition of proliferation, adhesion and migration of pancreatic cancer cells. @	1
Immunohistochemical analysis demonstrated a significant association between strong expressions of α6 integrin with uPAR in pancreatic cancer specimens. @	1
Furthermore, the strong expression of α6 integrin and uPAR was found to be independent prognosticator in pancreatic cancer patients.ConclusionBased on these findings, we conclude that IL-1α can induce selective upregulation of α6β1-integrin and uPA/uPAR in pancreatic cancer cells and these changes may modulate the aggressive functions of pancreatic cancer. @	1
BackgroundIn human pancreatic cancer progression, the α6β1-integrin is expressed on cancer cell surface during invasion and metastasis formation. `	0
In this study, we investigated whether interleukin (IL)-1α induces the alterations of integrin subunits and urokinase plasminogen activator/urokinase plasminogen activator receptor (uPA/uPAR) expression in pancreatic cancer cells. `	0
We hypothesize that the alterations of integrin subunits and uPA/uPAR expression make an important role in signaling pathways responsible for biological behavior of pancreatic cancer cells.ResultsIL-1α upregulated the expression of α6 and β1 integrins without any alterations of α5 and αv integrins expression. `	0
Regression models assessed the impact of clinician, patient and visit characteristics on overall visit length, time spent interacting with families, and time spent using the computer while interacting. `	1
RESULTS The mean overall visit length was 11:30 (min:sec) with 9:06 spent in the exam room. _	1
Clinicians used the EMR during 27% of exam room time and at all stages of the visit (interacting, chatting, and building rapport; history taking; formulation of the diagnosis and treatment plan; and discussing prevention) except the physical exam. _	1
Communication with the family accompanied 70% of EMR use. _	1
In regression models, computer documentation outside the exam room was associated with visits that were 11% longer (p=0.001), and female clinicians spent more time using the computer while communicating (p=0.003). _	1
CONCLUSIONS Among pediatric clinicians with EMR experience, conversation accompanies most EMR use. @	1
Our results suggest that efforts to improve EMR usability and clinician EMR training should focus on use in the context of doctor-patient communication. @	1
OBJECTIVES To characterize patterns of electronic medical record (EMR) use at pediatric primary care acute visits. `	0
DESIGN Direct observational study of 529 acute visits with 27 experienced pediatric clinician users. `	0
MEASUREMENTS For each 20 s interval and at each stage of the visit according to the Davis Observation Code, we recorded whether the physician was communicating with the family only, using the computer while communicating, or using the computer without communication. `	0
LIMITATIONS The 12 study practices shared one EMR. @	0
Further study of the impact of documentation inside versus outside the exam room on productivity is warranted. @	0
Major lower limb amputation and mortality were 19.2%, and 6.7% respectively. @	1
Conclusion : Preventive measures for patients at risk are highly needed as well early presentation is encouraged when ulcer develops in diabetic foot to avoid subsequent complications. @	1
Objective : To audit the management of diabetic septic foot [DSF] lesions in Omdurman Teaching Hospital, usingWagner classification. `	0
Patients and methods : This is a retrospective study on 208 patients with DSF admitted to Omdurman Teaching Hospital, Sudan between June 2006 and May 2007. `	0
Data were analyzed manually Results : The male to female ratio was 2:1. `	0
The mean age± SD was 56 ± 12.35 year. _	0
16.8% patients were grade 1. _	0
33 (15.9%) patients were grade 2. grades 3, 4, 5 patients were 66 (37 %), 38 (18.3%) and 36 (17.3%) respectively. _	0
Key words : Diabetes Mellitus, Diabetic septic foot, amputation @	0
AbstractThe projection dynamic thermal tomography method is applicable for testing of objects with irregular internal structure. `	1
It allows reliably detecting the foreign inclusion-type defects and controlling with high accuracy the geometric parameters of the internal structure of objects. _	1
It is designed for using modern IR cameras with a standard set of parameters and does not require expensive additional equipment. @	1
Preliminary numerical analysis of capabilities of the proposed method for specific objects and the parameters of expected defects is possible, indicating the requirements to the parameters of IR camera and heating. @	1
This method is superior in terms of information value to alternative methods. @	1
RESULTS In 162 patients who met inclusion criteria, the frequency of preoperative thrombocytosis was 8.6% (n=14). @	1
Patients with advanced FIGO disease (stages III-IV) and recurrence had significantly higher mean preoperative platelet counts than patients with early FIGO disease (stages I-II) and no recurrence (P=.0080 and P=.0063, respectively). @	1
Patients with thrombocytosis had statistically significant higher rates of advanced FIGO stages III-IV disease, unfavorable grades II-III endometrioid histology and recurrence than patients with preoperative platelet counts. @	1
BACKGROUND The impact of preoperative thrombocytosis as a prognostic factor in endometrial carcinoma (EC) remains uncertain and has never been examined in Saudi Arabia. `	0
OBJECTIVES To determine the prevalence of preoperative thrombocytosis (platelet count > 400 000/ μL), and its prognostic significance for clinicopathological factors and survival in Saudi patients with endometrioid-type EC. `	0
DESIGN A retrospective cross-sectional study from January 2010 to December 2013. `	0
SETTING A referral tertiary healthcare institute. _	0
PATIENTS AND METHODS Patients who underwent staging surgery for primary endometrioid-type EC were retrospectively analyzed for perioperative details: age, preoperative platelet count, International Federation of Gynecology and Obstetrics (FIGO) stage, endometrioid grade, recurrence, disease-free survival (DFS) and overall survival (OS). _	0
Survival analysis was conducted using Kaplan-Meier estimates and a Cox proportional hazards model. _	0
MAIN OUTCOME MEASURES Prevalence of preoperative thrombocytosis, DFS and OS. @	0
Using empirical data from Uganda, this research contributes to this gap by (1) exploring how household coping strategy relates to household characteristics and livelihood activity and (2) how these coping strategies vary depending on the hazard. _	1
Coping strategy is found to be hazard specific for households that lack market-orientated activities, whereas those with market access rely on economic activities regardless of hazard. @	1
To maintain and improve the livelihoods and coping strategies of those most vulnerable to climatic variability and change, policies that advocate diversification away from a sole reliance on cu... @	1
This paper investigates what drives household coping strategies in rural Uganda under different climatic hazards. `	0
Rural households in sub-Saharan Africa draw on various coping strategies to reduce the impact of climatic hazards on their livelihoods. `	0
Research to date provides only limited understanding of how the coping strategy portfolio of households changes depending on the climatic stress. _	0
In order to isolate, detect and estimate sensor faults, an augmented system is constructed by considering faults to be auxiliary state vectors. _	1
An unknown input LPV observer is designed to estimate simultaneously system states and faults. _	1
Sufficient conditions to guarantee stability and robustness against the uncertainty provided by the unmeasurable scheduling functions and the influence of disturbances are synthesized via a linear matrix inequality (LMI) formulation by considering H∞ and Lyapunov approaches. @	1
The performances of the proposed method are illustrated through the application to an anaerobic bioreactor model. @	1
Abstract This paper addresses the design of a state estimation and sensor fault detection, isolation and fault estimation observer for descriptor-linear parameter varying (D-LPV) systems. `	0
In contrast to where the scheduling functions depend on some measurable time varying state, the proposed method considers the scheduling function depending on an unmeasurable state vector. `	0
Here we review current literature on the pathogenic mechanisms driven by IL-17 during breast cancer progression and connect these findings to metastasis. _	1
These include (1) direct effects of IL-17 on tumor cells promoting tumor cell survival and invasiveness, (2) regulation of tumor angiogenesis, and (3) interaction with myeloid derived suppressor cells (MDSCs) to inhibit antitumor immune response and collaborate at the distant metastatic site. @	1
Furthermore, IL-17 might also be a culprit in bone destruction caused by late stage bone metastasis. @	1
Interestingly, in addition to these potential prometastasis functions, there is also evidence for an opposite, antitumor role of IL-17 during cancer therapies. @	1
Metastatic disease accounts for more than 90% of deaths from breast cancer. `	0
